{
  "target": "BTC/USD",
  "horizon": "1h",
  "context": {
    "market": "crypto",
    "purpose": "first MarketCell MVP analysis"
  },
  "candles": [
    {"timestamp": "2026-07-09T00:00:00Z", "open": 108000, "high": 108500, "low": 107500, "close": 108200, "volume": 1240},
    {"timestamp": "2026-07-09T01:00:00Z", "open": 108200, "high": 109300, "low": 108000, "close": 109000, "volume": 1380},
    {"timestamp": "2026-07-09T02:00:00Z", "open": 109000, "high": 109700, "low": 108600, "close": 109500, "volume": 1420},
    {"timestamp": "2026-07-09T03:00:00Z", "open": 109500, "high": 110200, "low": 108900, "close": 109900, "volume": 1500},
    {"timestamp": "2026-07-09T04:00:00Z", "open": 109900, "high": 112800, "low": 108700, "close": 111600, "volume": 4300}
  ],
  "events": [
    {
      "title": "大型机构继续增加 BTC ETF 风险敞口",
      "category": "institution",
      "sentiment": 0.55,
      "impact": 70,
      "freshness": 85
    },
    {
      "title": "宏观市场风险偏好回升，但能源价格波动扩大",
      "category": "macro",
      "sentiment": 0.1,
      "impact": 50,
      "freshness": 70
    }
  ]
}
